{
  "schema": "physicstest.matrix/1",
  "name": "behavior",
  "description": "03_WorkPlan M9 behaviour matrix (02 13 behavior): the behaviour scenes x every engine variant x UEParity, Normalized, recorded every frame (-StatesEvery=1 -> states.ptst + scene_desc.json for analysis/behavior.py). Deterministic scenes run once (R = 1: one exe is deterministic, M8 DET1); the chaotic scenes carry same-engine 1e-4 cm perturbation replicas (Perturb 1..3, docs/Scenes.md 1) for their sensitivity. M3.BoxPile 1k (900 frames, every 100th frame recorded) and the bullet.* probe targets reproduce Checkpoints N-1 (Bullet's pile collapses with 10 iterations and restitution 0.3); the jolt.Damp0 probe isolates UEParity's damping as the trigger of Jolt's 100:1 chain tearing apart (Progress M9). The physx.TGS-R0 / TGS-Pos32 / SdkDefault-Pos8 probes (M9 fix round 1) isolate PhysX TGS throwing boxes out of M3.BoxPile 1k (restitution, not iterations) and SdkDefault's late collapse (its 4 position iterations; Checkpoints N-4, N-5). The joint scenes (M6a/b/c) run on every target: Jolt, Bullet and PhysX declare PT_CAP_JOINT_BALL / _HINGE since M9 (abi-v1.1). Timing is not the point: Behavior run mode, recorded host check, no pre-roll; every number is UNOFFICIAL.",
  "purpose": "behavior",
  "preset": "test",
  "repeats": 1,
  "block_seed": 9009,
  "cooldown_s": 0.5,
  "timeout_s": 300,
  "contaminated_retries": 0,
  "window": "headline",
  "bench_args": [ "-RunMode=Behavior", "-HostCheck=record", "-PreRoll=0" ],
  "targets": [
    { "label": "jolt.Default", "backend": "Jolt", "variant": "Default" },
    { "label": "jolt.SharpBoxes", "backend": "Jolt", "variant": "SharpBoxes" },
    { "label": "bullet.Default", "backend": "Bullet", "variant": "Default" },
    { "label": "bullet.StaticAabbOff", "backend": "Bullet", "variant": "StaticAabbOff" },
    { "label": "bullet.R0", "backend": "Bullet", "variant": "Default", "bench_args": [ "-ini:PhysicsTest:[/Script/PhysicsTest.PhysicalMaterialDefaults]:Restitution=0" ] },
    { "label": "bullet.Iter50", "backend": "Bullet", "variant": "Default", "bench_args": [ "-ini:PhysicsTest:[PhysicsTest.Backend.Bullet]:NumIterations=50" ] },
    { "label": "bullet.R0Iter50", "backend": "Bullet", "variant": "Default", "bench_args": [ "-ini:PhysicsTest:[/Script/PhysicsTest.PhysicalMaterialDefaults]:Restitution=0,[PhysicsTest.Backend.Bullet]:NumIterations=50" ] },
    { "label": "jolt.Damp0", "backend": "Jolt", "variant": "Default", "bench_args": [ "-ini:PhysicsTest:[/Script/PhysicsTest.ForcedOverrides]:BodyInstance.LinearDamping=0" ] },
    { "label": "physx.UE4Compat", "backend": "PhysX", "variant": "UE4Compat" },
    { "label": "physx.UE4Compat-TGS", "backend": "PhysX", "variant": "UE4Compat-TGS" },
    { "label": "physx.UE4Compat-Stab", "backend": "PhysX", "variant": "UE4Compat-Stab" },
    { "label": "physx.SdkDefault", "backend": "PhysX", "variant": "SdkDefault" },
    { "label": "physx.TGS-R0", "backend": "PhysX", "variant": "UE4Compat-TGS", "bench_args": [ "-ini:PhysicsTest:[/Script/PhysicsTest.PhysicalMaterialDefaults]:Restitution=0" ] },
    { "label": "physx.TGS-Pos32", "backend": "PhysX", "variant": "UE4Compat-TGS", "bench_args": [ "-ini:PhysicsTest:[PhysicsTest.Backend.PhysX]:PositionIterations=32" ] },
    { "label": "physx.SdkDefault-Pos8", "backend": "PhysX", "variant": "SdkDefault", "bench_args": [ "-ini:PhysicsTest:[PhysicsTest.Backend.PhysX]:PositionIterations=8" ] }
  ],
  "profiles": [ "Normalized", "UEParity" ],
  "scenes": [
    { "scenario": "M1.SingleBoxDrop", "params": { "Case": "a" }, "bench_args": [ "-StatesEvery=1" ] },
    { "scenario": "M1.SingleBoxDrop", "params": { "Case": "b" }, "bench_args": [ "-StatesEvery=1" ] },
    { "scenario": "M2a.Tower", "params": { "N": "10", "Perturb": 0 }, "bench_args": [ "-StatesEvery=1" ] },
    { "scenario": "M2a.Tower", "params": { "N": "10", "Perturb": 1 }, "bench_args": [ "-StatesEvery=1" ] },
    { "scenario": "M2a.Tower", "params": { "N": "10", "Perturb": 2 }, "bench_args": [ "-StatesEvery=1" ] },
    { "scenario": "M2a.Tower", "params": { "N": "10", "Perturb": 3 }, "bench_args": [ "-StatesEvery=1" ] },
    { "scenario": "M2a.Tower", "params": { "N": "30", "Perturb": 0 }, "bench_args": [ "-StatesEvery=1" ] },
    { "scenario": "M2a.Tower", "params": { "N": "30", "Perturb": 1 }, "bench_args": [ "-StatesEvery=1" ] },
    { "scenario": "M2a.Tower", "params": { "N": "30", "Perturb": 2 }, "bench_args": [ "-StatesEvery=1" ] },
    { "scenario": "M2a.Tower", "params": { "N": "30", "Perturb": 3 }, "bench_args": [ "-StatesEvery=1" ] },
    { "scenario": "M3.BoxPile", "params": { "N": "1000" }, "frames": 900, "bench_args": [ "-StatesEvery=100" ] },
    { "scenario": "M4.InclineFriction", "params": { "Mu": "0.30", "BoxYaw": "0" }, "bench_args": [ "-StatesEvery=1" ] },
    { "scenario": "M4.InclineFriction", "params": { "Mu": "0.50", "BoxYaw": "0" }, "bench_args": [ "-StatesEvery=1" ] },
    { "scenario": "M4.InclineFriction", "params": { "Mu": "0.55", "BoxYaw": "0" }, "bench_args": [ "-StatesEvery=1" ] },
    { "scenario": "M4.InclineFriction", "params": { "Mu": "0.60", "BoxYaw": "0" }, "bench_args": [ "-StatesEvery=1" ] },
    { "scenario": "M4.InclineFriction", "params": { "Mu": "0.70", "BoxYaw": "0" }, "bench_args": [ "-StatesEvery=1" ] },
    { "scenario": "M4.InclineFriction", "params": { "Mu": "0.30", "BoxYaw": "45" }, "bench_args": [ "-StatesEvery=1" ] },
    { "scenario": "M4.InclineFriction", "params": { "Mu": "0.50", "BoxYaw": "45" }, "bench_args": [ "-StatesEvery=1" ] },
    { "scenario": "M4.InclineFriction", "params": { "Mu": "0.55", "BoxYaw": "45" }, "bench_args": [ "-StatesEvery=1" ] },
    { "scenario": "M4.InclineFriction", "params": { "Mu": "0.60", "BoxYaw": "45" }, "bench_args": [ "-StatesEvery=1" ] },
    { "scenario": "M4.InclineFriction", "params": { "Mu": "0.70", "BoxYaw": "45" }, "bench_args": [ "-StatesEvery=1" ] },
    { "scenario": "M5.BouncingBalls", "bench_args": [ "-StatesEvery=1" ] },
    { "scenario": "M6a.Pendulum", "params": { "Angle": "5", "Joint": "Hinge" }, "bench_args": [ "-StatesEvery=1" ] },
    { "scenario": "M6a.Pendulum", "params": { "Angle": "30", "Joint": "Hinge" }, "bench_args": [ "-StatesEvery=1" ] },
    { "scenario": "M6a.Pendulum", "params": { "Angle": "90", "Joint": "Hinge" }, "bench_args": [ "-StatesEvery=1" ] },
    { "scenario": "M6a.Pendulum", "params": { "Angle": "5", "Joint": "Ball" }, "bench_args": [ "-StatesEvery=1" ] },
    { "scenario": "M6a.Pendulum", "params": { "Angle": "30", "Joint": "Ball" }, "bench_args": [ "-StatesEvery=1" ] },
    { "scenario": "M6a.Pendulum", "params": { "Angle": "90", "Joint": "Ball" }, "bench_args": [ "-StatesEvery=1" ] },
    { "scenario": "M6b.Chain", "params": { "Perturb": 0 }, "bench_args": [ "-StatesEvery=1" ] },
    { "scenario": "M6b.Chain", "params": { "Perturb": 1 }, "bench_args": [ "-StatesEvery=1" ] },
    { "scenario": "M6b.Chain", "params": { "Perturb": 2 }, "bench_args": [ "-StatesEvery=1" ] },
    { "scenario": "M6b.Chain", "params": { "Perturb": 3 }, "bench_args": [ "-StatesEvery=1" ] },
    { "scenario": "M6c.HeavyChain", "params": { "Perturb": 0 }, "bench_args": [ "-StatesEvery=1" ] },
    { "scenario": "M6c.HeavyChain", "params": { "Perturb": 1 }, "bench_args": [ "-StatesEvery=1" ] },
    { "scenario": "M6c.HeavyChain", "params": { "Perturb": 2 }, "bench_args": [ "-StatesEvery=1" ] },
    { "scenario": "M6c.HeavyChain", "params": { "Perturb": 3 }, "bench_args": [ "-StatesEvery=1" ] },
    { "scenario": "M7.UEDefaults", "bench_args": [ "-StatesEvery=1" ] }
  ],
  "threads": [ 1 ],
  "exclude": [
    { "label": [ "jolt.SharpBoxes", "bullet.StaticAabbOff" ], "scenario": [ "M4.InclineFriction", "M5.BouncingBalls", "M6a.Pendulum", "M6b.Chain", "M6c.HeavyChain", "M7.UEDefaults" ],
      "reason": "the two M9 variants are box-margin / broadphase knobs: they are compared on the box scenes (M1, M2a, M3) only" },
    { "label": [ "bullet.R0", "bullet.Iter50", "bullet.R0Iter50" ], "scenario": [ "M1.SingleBoxDrop", "M4.InclineFriction", "M5.BouncingBalls", "M6a.Pendulum", "M6b.Chain", "M6c.HeavyChain", "M7.UEDefaults" ],
      "reason": "Checkpoints N-1 probes (restitution 0 of the default material and / or 50 iterations): only the stacks that use the default material (M2a, M3)" },
    { "label": "jolt.Damp0", "scenario": [ "M1.SingleBoxDrop", "M2a.Tower", "M3.BoxPile", "M4.InclineFriction", "M5.BouncingBalls", "M6a.Pendulum", "M6b.Chain", "M7.UEDefaults" ],
      "reason": "M9 probe (Progress M9 Jolt J-2): UEParity's linear damping 0.01 forced to 0 after authoring - only the 100:1 chain, which tears apart in UEParity and holds in Normalized" },
    { "label": "jolt.Damp0", "profile": "Normalized", "reason": "Normalized has no damping: the probe would repeat jolt.Default" },
    { "label": [ "physx.TGS-R0", "physx.TGS-Pos32", "physx.SdkDefault-Pos8" ], "scenario": [ "M1.SingleBoxDrop", "M2a.Tower", "M4.InclineFriction", "M5.BouncingBalls", "M6a.Pendulum", "M6b.Chain", "M6c.HeavyChain", "M7.UEDefaults" ],
      "reason": "M9 fix round 1 probes of the headline pile (Checkpoints N-4, N-5): TGS with the material restitution 0 / 32 position iterations (TGS throws boxes out of M3.BoxPile 1k), SdkDefault with UE4's 8 position iterations (its 4 / 1 pile collapses after frame 600) - M3.BoxPile only" }
  ]
}
